channelId,title,channelTitle,publishedAt
"UCpryVRk_VDudG8SHXgWcG0w","HIGHLIGHTS | Hibernian vs Arsenal (2-1) | Pre-season friendly | Smith Rowe scores","Arsenal","2021-07-13T22:00:08Z"
"UC0Fkh072D94BNdBM2bNrz_Q","DJ TERBARU VIRAL TIKTOK 2021 CHIKA LOKA","KELUD PRODUCTION","2021-07-12T05:07:06Z"
"UCmAbgFq6MEbQ7tO36zHfAIA","6 Obat Anosmia Alami untuk Mengatasi Indra Penciuman yang Hilang","NOVA","2021-07-13T12:27:05Z"
"UCNHqb1IRxQ5WBsWtO53JL2g","Buenos Aires erupts as Argentina beat Brazil in Copa América final","Guardian Football","2021-07-11T10:16:28Z"
"UCWGNHePUJW56gsPniGj5OEg","女主回國見男主，兩人激情熱吻 💖 中国电视剧","甜剧小屋","2021-07-12T12:00:13Z"
"UC5BMIWZe9isJXLZZWPWvBlg","Begini Nasib Oknum Satpol PP yang Aniaya Ibu Hamil di Gowa","KOMPASTV","2021-07-15T12:54:01Z"
"UCGfXjFgIUUTUUlzdG6BenXA","Gunakan Truk Sebagai Penyamaran, Polisi Tangkap Basah Pria Paruh Baya - Police Story 06/07","iNews Magazine","2021-07-06T14:30:05Z"
"UC7eoH2EuCZZoowe7QV5xJyA","Måneskin - Beggin' (Lyrics)","sunday","2021-07-07T16:26:40Z"
"UCEHprhvK2xu0CYKcnbMshBw","NAGIH  UTANG || KONTRAKAN REMPONG EPISODE 354","WARINTIL OFFICIAL","2021-07-12T03:00:31Z"
"UClODGUvIzrIxk1LnH75SxJQ","PENEMUAN ZAMAN BATU (PART 2) - SENGKLEKMAN","sengklekman","2021-07-15T11:15:12Z"
"UCfLza-BA-gyEc99yjJxE_UQ","DJ YANG MANIS TAPI BUKAN GULA REMIX VIRAL TIKTOK TERBARU 2021 | DJ YANG MANIS","Jay Stefan","2021-07-08T12:15:07Z"
"UC7RMi15o0aQacJhxOc6LLmw","ATEEZ JAPAN 1st SINGLE 'Dreamers' Music Video","日本コロムビア 公式YouTubeチャンネル","2021-07-11T15:00:20Z"
"UCaxNFw2ryxzjSAxRVP-0Dfg","Saat Teduh Bersama-PILIHAN HIDUP YANG MENENTUKAN KEPUASAN BATIN | 10/07/21(Official Philip Mantofa)","Philip Mantofa","2021-07-10T13:15:05Z"
"UCG0RYLzpSiwnT8HtTPmHkRw","NGOBROL SANTAI DENGAN Om2! @Edho Zell @Danidjidat","Gema Show Indo","2021-07-14T15:50:59Z"
