channelId,title,channelTitle,publishedAt
"UC7-sh4gtS5oJkwqOyt8s3CQ","GRANDONG LEBIH BESAR DARI YANG DIBAYANGKAN!! KOK JADI MIRIP GAJAH YA??","deHakims","2021-07-16T08:00:17Z"
"UC3IZKseVpdzPSBaWxBxundA","BTS (방탄소년단) 'Permission to Dance' Official MV","HYBE LABELS","2021-07-09T03:59:12Z"
"UCo8h2TY_uBkAVUIc14m_KCA","Curhat Emak-Emak Cari Nafkah, Dilema Aparat di Lapangan - Dilema Negeri +62 (Part 2) | Mata Najwa","Najwa Shihab","2021-07-14T23:01:01Z"
"UCKII0Ml9S5wneKbHswmUrIQ","Tolak Bayar Denda, Pelanggar PPKM Pilih Dipenjara","CNN Indonesia","2021-07-14T02:00:15Z"
"UC8-Th83bH_thdKZDJCrn88g","BTS: Permission to Dance (TV Debut) | The Tonight Show Starring Jimmy Fallon","The Tonight Show Starring Jimmy Fallon","2021-07-14T04:30:11Z"
"UC43nz9qnZ7AIrbOlfxejTig","KIAT OUTDOOR KEREN DAN TIPS DIY TAMASYA || Kiat Pantai Terkeren Supaya Tamasyamu Seru oleh 123 GO!","123 GO! Indonesian","2021-07-12T15:00:11Z"
"UC0k3T5AJYvKnuc52bB7rJTA","DENNY CAKNAN feat. GUYON WATON - WIDODARI (Official Music Video)","DENNY CAKNAN","2021-07-10T12:30:14Z"
"UCQA6NejSxQguRkD3L8eXHzA","Berhasil Rebut Simpati Masyarakat, Ini Sosok Paspampres Praka Izroi Gajah","iNews id","2021-07-10T10:19:49Z"
"UC5BMIWZe9isJXLZZWPWvBlg","Buntut Cekcok Paspampres Saat Penyekatan, Propam Polda Metro Jaya Periksa Anggotanya","KOMPASTV","2021-07-08T07:56:50Z"
"UC8-Th83bH_thdKZDJCrn88g","BTS: Butter | The Tonight Show Starring Jimmy Fallon","The Tonight Show Starring Jimmy Fallon","2021-07-15T04:30:09Z"
"UC9OUldB9j6PS5_WP77Lz0Uw","LESTI SEDIH, PULANG KAMPUNG MINTA RESTU KELUARGA BESAR","LESTI CHANNEL","2021-07-15T09:00:11Z"
"UCJpdpj9hNhaYBRGusGv7CjQ","Puluhan Paspampres Geruduk Polres Jakbar Seusai Oknum Polisi Cekcok dengan Praka Izroi","Tribun Jateng","2021-07-09T04:26:17Z"
"UCaAE5pyrskvGdHmypXxqncA","Lyodra - Kalau Bosan (Official Music Video)","LyodraVEVO","2021-07-15T17:00:13Z"
"UCLkAepWjdylmXSltofFvsYQ","[CHOREOGRAPHY] BTS (방탄소년단) 'Permission to Dance' Dance Practice","BANGTANTV","2021-07-13T12:00:05Z"
"UC43nz9qnZ7AIrbOlfxejTig","MURID KAYA VS MURID BOKEK || Situasi Lucu dalam Kehidupan Nyata oleh 123 GO!","123 GO! Indonesian","2021-07-15T14:00:17Z"
"UCER4rvDnRBPr_ncYW4UCZjg","Terkait Kontroversi dr. Lois, Babeh Aldo: dr. Lois Adalah Dokter Pertama yang Berani Bersuara | AKIM","tvOneNews","2021-07-13T13:57:43Z"
"UCJpdpj9hNhaYBRGusGv7CjQ","Tangis Polisi Pecah Dekap Bocah Yatim Piatu yang Ceritakan Unek-unek Hidupnya","Tribun Jateng","2021-07-13T17:00:57Z"
"UC43nz9qnZ7AIrbOlfxejTig","MASA KEHAMILAN LANCAR VS MASA KEHAMILAN RIBET || Momen Kehamilan Lucu oleh 123 GO!","123 GO! Indonesian","2021-07-14T13:15:01Z"
"UCmB1_agPlXbbwTCPKEuwEKA","Tasya Rosmala ft. New Pallapa - Haruskah Aku Mati (Official Music Video ANEKA SAFARI)","Aneka Safari Records","2021-07-12T06:00:14Z"
"UCbJWkrWIB4W-oR-cOASEBsQ","Boruto Episode 207 Sub Indo Terbaru PENUH FULL HD | Boruto Episode 207 Subtitle Indonesia HD","V Movies","2021-07-11T11:26:56Z"
"UC1COz5-ymC7FALbIPii5dwQ","Pesan Terakhir","Lyodra - Topic","2021-07-15T10:06:00Z"
"UCdOovgmIPfj9a-o3VP5i2_g","Komandan Paspampres Ungkap Ada Perkataan Polisi Singgung Institusi Negara","MerdekaDotCom","2021-07-09T10:59:51Z"
"UCcDhPsZnQKMn_4DfDBuYg1Q","HIGHLIGHTS ARGENTINA 1 - 0 BRASIL | COPA AMÉRICA 2021 | 10-07-21","Copa América","2021-07-11T03:10:03Z"
"UCe8yjo839EIfDdj8LgBb1ZA","(COVER INDIA) Selfi YammaFeat Fildan - Mile Ho Tum Humko Neha Kakkar","Selfi Yamma LIDA","2021-07-11T17:00:10Z"
"UCXxHcPruufr4DrgFqLNnGOQ","Detik Detik Kronologi Penangkapan Nia Ramadhani & Ardi Bakrie | Intens Investigasi","Intens Investigasi","2021-07-08T11:15:05Z"
"UCoC47do520os_4DBMEFGg4A","我们中国人的开门七件事，柴米油盐酱醋茶 Firewood, rice, oil, salt, soy sauce, vinegar, and tea丨Liziqi Channel","李子柒 Liziqi","2021-07-14T12:12:22Z"
"UCt9a_qP9CqHCNwilf-iULag","Sergio Ramos : Première journée d'entraînement","PSG - Paris Saint-Germain","2021-07-12T18:40:39Z"
"UCbygpKn8gqj1LMTMyROF9fg","Rizky Febian & Ziva Magnolya - Terlukis Indah (Official Music Video)","Rizky Febian","2021-07-14T07:00:10Z"
"UCWhiN5fWklGLtLZTJEAZ-vw","JIKA AKU MENIKAH TAHUN INI..  #OSHICIS 🔥‼️","Dokter Shindy","2021-07-14T03:22:29Z"
"UCCaZhsZjcmWZpOJNaLyM-kA","【SORA AOI】Wawancara dengan SOLA AOI !! 　*Nama Aslinya SOLA 🙏","DAISUKE BOTAK","2021-07-14T12:00:30Z"
"UChCovZlgNh2x6Z57MJ5fhFw","Italia 1 - 1 Inglaterra [3-2] | EUROCOPA 2020 - FINAL 🏆","TNT Sports Chile","2021-07-12T04:31:04Z"
"UCEIi7zFR_wE23jFncVtd6-A","[Artist Of The Month] 'Watermelon Sugar' X 'BLOW' covered by TXT YEONJUN(연준) | July 2021 (4K)","STUDIO CHOOM [스튜디오 춤]","2021-07-16T14:00:02Z"
"UC7-sh4gtS5oJkwqOyt8s3CQ","IZIN SELURUH KELUARGA UNTUK QURBAN SAPI, GRANDONG DARI SETIA FARM..","deHakims","2021-07-08T14:00:14Z"
"UCcSVA15A6UNouOvHsixy1ng","Haruskah Aku Mati - Woro Widowati - New Pallapa ( Official Music Video )","PERDANA RECORD","2021-07-06T12:00:15Z"
"UCLiy-C7YdWBxg8D9XWxWq1w","DIKASIH KEJUTAN ULTAH, AYU TING TING MINTA DINIKAHIN! HARUS DISUKAI BILQIS? - DITANYA ROBBY","Robby Purba","2021-07-10T11:00:14Z"
"UCO8nJdYIZO2TD8j3JN_xDFw","DRAMA! BACAIN MASALAH ART PARA NETIJEN! #CuTime","rachel goddard","2021-07-15T12:00:10Z"
"UCmxAIW7RDDC88EPk4ry16Kg","Viral Puluhan Paspampres Geruduk Polres Jakbar, Kapolres: Ada Kesalahpahaman, Tapi Sudah Selesai","Tribunnews.com","2021-07-08T09:33:08Z"
"UC994bmxwjaWuf6ggRBz0f3g","HARUSKAH AKU MATI Duet Terbarunya GERY MAHESA LALA WIDI","MP Production","2021-07-14T07:00:13Z"
"UCmlgRPrwvyHaS1jYXJifNqg","dia yang bikin video, gue yang malu.","Picky Picks","2021-07-16T12:33:36Z"
"UC1COz5-ymC7FALbIPii5dwQ","Dibanding Dia","Lyodra - Topic","2021-07-15T10:02:28Z"
"UCamwEBao0i0J1_Nqf3beqgA","#suaratirta : BERITA HOAX COVID HARI INI","Tirta PengPengPeng","2021-07-07T11:37:03Z"
"UCTaLuDatJ-2Y-YnXWA7UKzQ","NGASIH UANG 14 JUTA CASH + UANG DARI JUAL MOTOR GW, KE MBA ASMARA | Bro Omen","Bro Omen","2021-07-15T23:52:03Z"
"UCpiCK8c6PBktcxq7Az_t4RQ","Song Kang gives Han So-hee birthday kisses on the kitchen countertop | Nevertheless, Ep 4 [ENG SUB]","The Swoon","2021-07-12T01:00:05Z"
"UCzCedBCSSltI1TFd3bKyN6g","D.O. 디오 '공감' Mood Sampler Ver.1","EXO","2021-07-14T15:00:33Z"
"UCzTsWuCdVP_vehWyGwPcS3Q","IKATAN CINTA - Cemburu Bingitzz!! Disangka Ikutin Cewek Cantik, Mas AL Dijewer Sama Andin","RCTI - LAYAR DRAMA INDONESIA","2021-07-15T17:29:10Z"
"UCOmHUn--16B90oW2L6FRR3A","BLACKPINK - 「Lovesick Girls - JP Ver.-」 MV","BLACKPINK","2021-07-12T23:00:18Z"
"UCKECwHOIAZkpv7c1hqg1mWw","Lakukan Ini jika Anggota Keluarga Alami Sesak Napas | lifestyleOne","lifestyleOne","2021-07-11T05:00:06Z"
"UCM6UGAIyUR3E1-m419VZmXw","RITUAL USIR PAGEBLUK LAMPOR KERANDA TERBANG - MBAH MIJAN","Mbah Mijan","2021-07-14T15:13:17Z"
"UCLiy-C7YdWBxg8D9XWxWq1w","PESAN AYU TING TING UNTUK ORANG YANG MENJATUHKANNYA! - DITANYA ROBBY","Robby Purba","2021-07-13T11:00:13Z"
"UCaQmWyRdzrgqdlAqtQO22ZQ","ALASAN JUJUR BILLY SYAHPUTRA PUTUS DENGAN AMANDA MANOPO | PART II","DENNY CAGUR TV","2021-07-11T05:54:05Z"
"UCYk4LJI0Pr6RBDWowMm-KUw","MERINDING GUE DENGER INI, GOKIL‼️ SEREM ABIS‼️ - Mongol - Deddy Corbuzier Podcast","Deddy Corbuzier","2021-07-01T04:20:38Z"
"UCMnHHuh31bFJ608NQZXrGtw","SHOLAWAT PENYEJUK HATI PENENANG PIKIRAN || ​KUMPULAN SHOLAWAT NABI MERDU TERBARU 2021","Lagu Sholawat Nabi","2021-07-12T23:15:03Z"
"UC5BMIWZe9isJXLZZWPWvBlg","Komandan Paspampres Angkat Bicara Terkait Keributan Anggotanya dengan Polisi di Pos Penyekatan","KOMPASTV","2021-07-09T07:21:12Z"
"UCLkAepWjdylmXSltofFvsYQ","#BTS #PermissiontoDance ✌✌ challenge only on @YouTube #Shorts starting Jul 23rd. Get ready to 🕺💃","BANGTANTV","2021-07-09T13:30:02Z"
"UCzl0OrB3-ehunyotIQvK77A","Kronologi Penangkapan Nia Ramadhani dan Ardi Bakrie","metrotvnews","2021-07-08T07:29:32Z"
"UCdOovgmIPfj9a-o3VP5i2_g","Komandan Paspampres Beberkan Fakta, Terungkap Alasan Anggotanya Geruduk Polres Jakbar","MerdekaDotCom","2021-07-09T05:04:11Z"
"UC1dI4tO13ApuSX0QeX8pHng","TINGGAL SETENGAH HARGA! Nikmatnya beli iPhone Xr di tahun 2021!","GadgetIn","2021-07-12T10:01:47Z"
"UC0jPwNs4B7yJySNewHan5hQ","Lionel Messi leads Argentina to glory for the first time claiming 2021 Copa America over Brazil","Optus Sport","2021-07-11T02:12:35Z"
"UCLxAS02eWvfZK4icRNzWD_g","I Don't Want To Miss A Thing - Music Travel Love ft. Felix Irwan","Music Travel Love","2021-07-14T00:00:54Z"
"UCADZVxC_4omYiNDLcsDoCeg","KAGET PAS DENGAR PENJUAL ES INI NGOMONG, TERNYATA FASIH BHS JEPANG!!","Londokampung","2021-07-13T11:00:24Z"
"UCYRZrmjJOX3NDxt2UdFKy0Q","Lionel Messi Celebrations & Crazy Moments After Winning !","BD10HD","2021-07-11T03:27:00Z"
"UChFv0WPR47xMAPpCJWUgk1Q","Esa Risty - Lebu (Official Music Video) | Goyang Mletree Asekk Bosque","Esa Risty Official","2021-07-14T02:00:12Z"
"UCrEtZcG9h9lx9oqQhros_Dg","NGERI! Ratusan Ojol vs Debt Collector Bentrokan di Mangga Besar, Jakpus #SIP 07/07","Seputar iNews","2021-07-07T03:41:14Z"
"UCEa5arMfQcOrmHGwh2cVbHw","Esa Risty - Kelangan | Koplo Version (Official Music Video)","ARD Management","2021-07-15T01:00:19Z"
"UCq2qjWz4wHTLOPtRGdsWgBA","My Stanford Graduation - What I learned","Maudy Ayunda","2021-07-12T03:00:11Z"
"UCoSkllfpgmFHtbVK835QaQg","Astaga! Habis Razia PPKM, Petugas Dishub Langgar PPKM Kini Dipecat #iNewsSore 09/07","Official iNews","2021-07-09T12:54:53Z"
"UC8t925VdEYkPkNrgAc9TTUw","HAPPY ASMARA - EMAS HANTARAN [ Remix Jhandut ] ( Official Music Video )","FORTUNA ENTERPRISE","2021-07-13T08:00:14Z"
"UCRvcjozVQBiOMQ4UyoAy-fA","Angel - Woro Widowati ft Dangduters Band","WORO WIDOWATI OFFICIAL","2021-07-15T08:00:13Z"
"UC-AlofdKECUdhXrbJQZ6iEg","Måneskin - Beggin' (Lyrics/Testo)","LatinHype","2021-07-15T21:10:57Z"
"UCxtuzvYz8iSZskiRa01t7zg","CUCURUTUT Charity Stream 12 Jam untuk Lawan COVID-19 di Indonesia","Christopher Devin","2021-07-16T18:39:42Z"
"UChDuhCkrQ8IhdzSh2X7CkWg","Rizky Febian, Ziva Magnolya - Terlukis Indah (Official Lyric Video)","ZivaMagnolyaVEVO","2021-07-08T17:00:35Z"
"UCE6zDe5DgDoic9xQYDqLNGQ","KRETEK ABAL2 IRFAN HAKIM DEPAN MEGATANK! REQUEST KALIAN!","BEEMZ ARYO","2021-07-15T08:52:09Z"
"UC0jPwNs4B7yJySNewHan5hQ","HIGHLIGHTS: Argentina v Brazil | Copa America Final","Optus Sport","2021-07-11T02:54:58Z"
"UCvR2R7j218tzejtTsb_X6Rw","Here's Your Perfect - Jamie Miller (Lyrics) 🎵","DopeLyrics","2021-07-15T16:52:14Z"
"UC7FE8E7nCP-sJO8o4FTo93Q","DC MUSIK || TOMPEL Ft. VITA ALVIA - BODO AMAT (OFFICIAL LIVE MUSIC)","DC. PRODUCTION","2021-07-14T12:00:11Z"
"UC3IZKseVpdzPSBaWxBxundA","BTS (방탄소년단) 'Permission to Dance' Official Teaser","HYBE LABELS","2021-07-06T15:00:03Z"
"UCX7RJTce2MLIfE4e8QxRl4g","KUAT ATI (Pujaan Hati Tak Suwun Sing Kuat Ati) | KALIA SISKA FT SKA 86 | KENTRUNG VERSION","UYE tone","2021-07-11T12:00:14Z"
"UC4x-hPeNK61k61xgChcVGNA","Balungan Kere | Woro Widowati Feat Wandra | New Pallapa Official | Album Terkoplo 2021","New Pallapa Official","2021-07-09T03:00:14Z"
"UC6FjcBcH9NVHdfFSvNfHmuA","SEMPROD: ANDHIKA BORIS GAK PERCAYA GADING NANGIS DIPUTUSIN PACAR! UUS PERNAH BACKSTREET SAMA ARTIS?!","KUY Entertainment","2021-07-14T12:00:17Z"
"UCaxNFw2ryxzjSAxRVP-0Dfg","Saat Teduh Bersama - PEMBELAKU SAAT KU JATUH | 14 Juli 2021 (Official Philip Mantofa)","Philip Mantofa","2021-07-14T13:24:03Z"
"UCbPryJBU1M6mfYJXVYsSKow","PPMM (Peraturan Pemimpin Memiskinkan yang Miskin) - KOMEDI ARYKAKUL","ARYKAKUL BALI","2021-07-14T13:28:34Z"
"UC7Zgj5p9QOuz65oDU51Jlng","GADUH #2","Rana Films","2021-07-07T09:23:53Z"
"UC2sVRtimSUdDN2myZ6Cf03w","Nella Kharisma Feat. Dory Harsa - Ngidam Pentol [OFFICIAL]","Nella Kharisma Official","2021-07-05T12:00:15Z"
"UC0Fkh072D94BNdBM2bNrz_Q","DJ SETIAP YANG KU LAKUKAN  UNTUK DIRIMU VIRAL TIKTOK BAHAGIA SLOW BEAT SYAHDU","KELUD PRODUCTION","2021-07-14T05:12:42Z"
"UC4x-hPeNK61k61xgChcVGNA","New Pallapa Official | Angel - Wandra Feat Esa Risty | Album Terkoplo 2021","New Pallapa Official","2021-07-13T04:00:14Z"
"UC9JY9P4rTWxptNDqMVq6uDQ","Bringing Down the House #shorts","Goodwin Family","2021-07-04T06:47:53Z"
"UCgFvT6pUq9HLOvKBYERzXSQ","These Indonesian Bassists Must Be STOPPED","Davie504","2021-07-10T13:00:35Z"
"UCgiO267R4Qo-SJF2UzH5ccQ","Ngeri! Kasus-Kasus Makan Makanan Super Pedas Ini Berujung Malapetaka","The Shiny Peanut","2021-07-10T05:30:09Z"
"UC8BBYSn3Hs0mWIYZngwRB2Q","PRAHARA RUMAH TANGGA  RUWET TV ","Ruwet TV","2021-07-14T06:07:27Z"
"UCGXnDxirLuSrIHwQXWxRzeg","BERUNTUNG VS APES || Momen Lucu yang Pernah Dialami Semua Orang oleh 123 GO Like!","123 GO LIKE! Indonesian","2021-07-08T11:54:04Z"
"UCekLikuCSxA_gB7MW4trIlQ","BAO Disney Pixar Short Film Official Promos | Incredibles 2 Bonus (2018) Animation Adventure HD","AniBox Trailer Access","2021-07-09T16:45:04Z"
"UC8h30UMUb7emuKob0OV_6zg","Tik Tok Thời Trang Con Nhà Nghèo Sáng Tạo Cực Chất P48 - Fashion for Poor People P48 - Tik Tok China","Mina Tik Tok","2021-07-09T00:00:08Z"
"UCamwEBao0i0J1_Nqf3beqgA","#suaratirta : TIPS ISOMAN COVID YANG BENAR","Tirta PengPengPeng","2021-07-09T11:58:24Z"
"UCcDhPsZnQKMn_4DfDBuYg1Q","HIGHLIGHTS ARGENTINA 1 (3) - (2) 1 COLOMBIA | COPA AMÉRICA 2021 | 06-07-21","Copa América","2021-07-07T04:10:01Z"
"UC8-Th83bH_thdKZDJCrn88g","BTS Dishes on Touring and Working with Ed Sheeran | The Tonight Show Starring Jimmy Fallon","The Tonight Show Starring Jimmy Fallon","2021-07-14T04:00:07Z"
"UC9vrvNSL3xcWGSkV86REBSg","Permission to Dance","BTS - Topic","2021-07-09T04:09:47Z"
"UCGXnDxirLuSrIHwQXWxRzeg","TANTANGAN SENI #2! || Tantangan Menggambar Lucu oleh 123 GO Like!","123 GO LIKE! Indonesian","2021-07-05T16:59:43Z"
"UCTkY7c2Spbl33NBbyQNGlZg","Yeni Inka - Jang Ganggu (Official Music Video)","Selosakti Records","2021-07-16T03:00:15Z"
"UCZW5lIUz93q_aZIkJPAC0IQ","Rich Brian, NIKI, & Warren Hue - CALIFORNIA [Jackson Wang Remix] 💔💔💔","88rising","2021-07-15T04:00:13Z"
"UC9GtSLeksfK4yuJ_g1lgQbg","aespa 에스파 l 태연 TAEYEON 'Weekend' MV Reaction","aespa","2021-07-15T11:00:17Z"
"UCYRZrmjJOX3NDxt2UdFKy0Q","Lionel Messi - Respect Moments Everyone Should Witness","BD10HD","2021-07-13T02:27:25Z"
"UCuTKrQEt651z729A9-S8hZw","청량미 가득💕 기타까지 완벽한 로제(ROSÉ)의 〈The Only Exception〉♬ 바라던 바다(sea of hope) 3회 | JTBC 210713 방송","바라던 바다","2021-07-13T14:44:01Z"
"UCqAbZgOUGWA1R4GMqcRFtsg","🔴EKSKLUSIF! AKHIRNYA W / WENNY ARIANI MUNCUL PERTAMA KALI DI DPN PUBLIK CERITAKAN REZKY! (PART 1)","Denny Darko","2021-07-07T12:00:12Z"
"UC8JlyvzVN8nJ1w8rGIjdGrQ","Pantas Wajah Bulenya Berbeda Dengan 4 Kakaknya, Ternyata Begini Silsilah Keluarga Nia Ramadhani","Tribun Manado Official","2021-07-08T08:23:18Z"
"UCzTsWuCdVP_vehWyGwPcS3Q","IKATAN CINTA - Kesal!! Bikin Mamanya Menangis, Reyna Marah Dan Gak Mau Ketemu Sama Nino","RCTI - LAYAR DRAMA INDONESIA","2021-07-14T17:20:01Z"
"UClMQ1QriptEXMpMBw_8EeqQ","Rossa - Wanita (Official Lyric Video)","Rossa Official","2021-07-16T05:00:21Z"
"UCEHprhvK2xu0CYKcnbMshBw","BALAI PERTEMUAN || KONTRAKAN REMPONG EPISODE  355","WARINTIL OFFICIAL","2021-07-14T03:00:14Z"
"UCkKbg-8rc_9IcHQzTsu1uLQ","KURANG AJAR ISTRI GW MAU DIBOOKING 20 JUTA!! @JASTIN11DC SAYA CARI ANDA!!","KR TV","2021-07-12T14:18:23Z"
"UCmxAIW7RDDC88EPk4ry16Kg","Oknum Satpol PP Gowa yang Pukul Pasutri Terancam Kurungan 5 Tahun, Polisi Ungkap Motif Pemukulan","Tribunnews.com","2021-07-16T03:19:16Z"
"UCR-hohVc5y6wdrFc99Lk1_Q","Terlibat Kasus Narkoba, Nia Ramadhani Diadukan Sopirnya #LIM 08/07","Lintas iNews","2021-07-09T01:36:56Z"
"UCLttSYJ6kPtlcurY96kXkQw","IL PRIMO TEST! | ROMA-MONTECATINI  10-0","AS Roma","2021-07-15T18:40:10Z"
"UCxmrFvg9g2jdErW587nm7-g","Panggilan Spesial Fiki Naki untuk Luna Maya | TS Talks Eps.30","TS Media","2021-07-10T13:00:13Z"
"UCxxnxya_32jcKj4yN1_kD7A","Tokyo Revengers - Episode 14 [Takarir Indonesia]","Muse Indonesia","2021-07-10T18:38:11Z"
"UC4x-hPeNK61k61xgChcVGNA","New Pallapa Official | Menungso Ora Toto | Shepin misa | Album Terkoplo 2021","New Pallapa Official","2021-07-16T03:18:35Z"
"UCwD9E_QNwFwrQC7OnPnrg2Q","Euro 2020 final: Italy and England fans react to final penalty kick","Guardian Sport","2021-07-11T23:15:32Z"
"UC7uo2PDGc-KBiHdjKcTzWRQ","Sasya Arkhisna - Lemah Teles (Official Music Video Langit Biru Record)","Langit Biru Record","2021-07-13T11:30:15Z"
"UC9rMiEjNaCSsebs31MRDCRA","Hyunjin Play With Fire (Feat. Yacht Money) (원곡 : Sam Tinnesz) | [Stray Kids : SKZ-PLAYER]","Stray Kids","2021-07-09T14:59:57Z"
"UCER4rvDnRBPr_ncYW4UCZjg","Soal Kasus Pemukulan Oknum Satpol PP di Gowa, Korban: Istri Saya Syok Berat Sampai Dilarikan ke RS","tvOneNews","2021-07-15T13:42:54Z"
"UC7Zgj5p9QOuz65oDU51Jlng","GADUH #1","Rana Films","2021-07-05T13:41:41Z"
"UCvWuQfTMrRny57Cl3qtEmmg","Italy vs England - Penalty Shootout - Final EURO 2020 - eFootball PES 2021","Football TV","2021-07-11T14:51:55Z"
"UCk3JZr7eS3pg5AGEvBdEvFg","KING FISH GRILL | Spanish Mackerel Fish Grill with Banana Leaf | Fish Fry Recipe Cooking In Village","Village Cooking Channel","2021-07-14T14:08:30Z"
"UCMWs0TT4Ga64c4WDEB-mfIQ","Lionel Messi Best Ever Copa America 2021","Wouva","2021-07-12T09:00:02Z"
"UCsE7IVpsU-jk6vAdBP9ZREg","LINEUP RRQ HOSHI MPL SEASON 8 : SIXTH PLAYER","Team RRQ","2021-07-12T15:26:39Z"
"UCepUWUpH45hRTi-QePdq1Bg","[ENG] [스트릿 우먼 파이터] Eat You Up + Better - YGX | 글로벌 평가","Mnet Official","2021-07-12T02:30:01Z"
"UCr8WCDMH5PpPq6uUxHg5A7w","VIRAL PETUGAS PPKM VS PENJUAL KOPI SAAT PENERTIBAN COVID19","Tribun Kaltim Official","2021-07-11T14:00:54Z"
"UCvM5NAeWfAzML4We-meb26w","BAKUL CIU VS BAKUL TUAK - FILM PENDEK","deedee ka","2021-07-10T12:00:58Z"
"UCyGa1YEx9ST66rYrJTGIKOw","BONUCCI, CHIESA, DONNARUMMA | ITALY'S winning story at EURO 2020","UEFA","2021-07-15T07:00:23Z"
"UCe4cPmA9HNcCRYEGuknngZA","HARUSKAH AKU MATI  [ koplo ] ~ Era Syaqira  |  Andai kau merasakan sakit yang kau berikan kepadaku","Khatulistiwa Record","2021-07-10T02:00:11Z"
"UCLLGM0MV2OpvwFCjG70nkIg","Ndarboy Genk - Mendung Tanpo Udan (Official Music Video) Versi Dangdut","Ndarboy Genk","2021-07-05T08:00:10Z"
"UC-S7cyZCojMeVopBkH6yNEw","TANTANGAN MAKANAN HITAM VS PINK || Makan Hanya 1 Warna Selama 24 Jam oleh 123 GO! CHALLENGE","123 GO! CHALLENGE Indonesian","2021-07-03T10:00:08Z"
"UCamwEBao0i0J1_Nqf3beqgA","#suaratirta : INFO HOAX COVID HARI INI (PART 2)","Tirta PengPengPeng","2021-07-13T11:29:28Z"
"UCGAGPNod17fLs8blfuev4hA","NGAMBIL MOBIL BARU DARI DEALER","Ridwan Hanif Rahmadi","2021-07-13T09:00:07Z"
"UCppou5iYD1t_sMx2t_DHikw","(ENG) BTS 진에게 신곡 스포일러를 부탁해보았습니다","혀니콤보 TV","2021-07-16T11:00:02Z"
"UC7GWXKxiy9_AU9TytEh00eg","Nenek Setan - Selalu Memaksaku Ikut ke Kuburan #HORORMISTERI | Kartun Hantu Nenek, Animasi Horor","Rizky Riplay","2021-07-10T02:00:32Z"
"UCepUWUpH45hRTi-QePdq1Bg","[ENG] [스트릿 우먼 파이터] Eat You Up + Better - 원트(WANT) | 글로벌 평가","Mnet Official","2021-07-12T02:30:08Z"
"UC8h30UMUb7emuKob0OV_6zg","Tik Tok Thời Trang Con Nhà Nghèo Sáng Tạo Cực Chất P52 - Fashion for Poor People P52 - Tik Tok China","Mina Tik Tok","2021-07-13T00:00:05Z"
"UCE8bELwgAQMo5caLbV0_M6g","Woh Tera Kehna Ki Main | Dhadkan | LoveStory | KADAK MASALA","Kadak Masala","2021-07-13T14:15:00Z"
"UCUnVodBnteAdGONNcUpS_kw","Il ritorno degli Azzurri a Roma dopo la vittoria dell’Europeo | EURO 2020","FIGC Vivo Azzurro - Nazionale Italiana Calcio","2021-07-12T09:57:12Z"
"UCMzrwuE3rclpD7kVNxuPKtw","Akhirnya saya kena Covid Varian DELTA (Maaf saya Off dulu dari Youtube)","SuccessBefore30","2021-07-07T11:16:38Z"
"UC4i_9WvfPRTuRWEaWyfKuFw","This guy is a dirtbag! Dustin Poirier on Conor McGregor after heated UFC 264 main event.","BT Sport","2021-07-11T04:43:13Z"
"UCER4rvDnRBPr_ncYW4UCZjg","Warga Resah Dengan Suara Sirine, Mobil Ambulans Masuk Kampung Keputih Diminta Matikan Sirine","tvOneNews","2021-07-15T13:02:38Z"
"UCX6OQ3DkcsbYNE6H8uQQuVA","Would YOU Quit School For $100,000?","MrBeast","2021-07-10T20:00:09Z"
"UCJpdpj9hNhaYBRGusGv7CjQ","Viral Warga Geruduk RSUD Situbondo Tuduh Covidkan Korban Kecelakaan","Tribun Jateng","2021-07-15T06:18:30Z"
"UCsObGXVUdSh-bHT7CdVXrrw","Lionel Messi Against All Odds - Argentina","MagicalMessi","2021-07-13T06:56:12Z"
"UCqPbkJrjrsQb_RGlC_4HEgg","The Kid LAROI, Justin Bieber - Stay (Official Video)","TheKidLAROIVEVO","2021-07-09T04:00:12Z"
"UCmxAIW7RDDC88EPk4ry16Kg","SOSOK Mayjen TNI Agus Subiyanto, Danpaspampres yang Bela Praka Izroi soal Cekcok di Pos Penyekatan","Tribunnews.com","2021-07-10T04:18:40Z"
"UCzTsWuCdVP_vehWyGwPcS3Q","IKATAN CINTA - Gak Punya Cara Lain!! Nino Diam-Diam Bawa Reyna Untuk Tes DNA","RCTI - LAYAR DRAMA INDONESIA","2021-07-13T17:26:48Z"
"UCyGa1YEx9ST66rYrJTGIKOw","Vote for your EURO 2020 Goal of the Tournament!!","UEFA","2021-07-13T13:18:33Z"
"UCZIEmkvbSV8wBVWnP4wgftA","KELAS METAFISIKA: MERUWAT DAN MENGHINDAR DARI TUMBAL","Kisah Tanah Jawa","2021-07-10T14:00:24Z"
"UCmiJjv8BbzLahKpsfkQaBnA","Arief feat Tryana - Cinta Sehebat Mentari (Official Music Video)","Arief Putra","2021-07-10T02:00:15Z"
"UCYk4LJI0Pr6RBDWowMm-KUw","SEBARKAN‼️ BIG DOC VS COVID‼️ SEBELUM DI TAKEDOWN‼️ dr. Henry Suhendra - Deddy Corbuzier Podcast","Deddy Corbuzier","2021-07-13T04:21:30Z"
"UCdOovgmIPfj9a-o3VP5i2_g","Aksi Sangar Paspampres Praka Izroy saat Tenteng Senjata, Sang Perisai Hidup Wapres","MerdekaDotCom","2021-07-12T02:00:13Z"
"UC_SBt2BFBkExq_azj-P5lNA","PENAMPAKAN MAKHLUK2 MITOLOGIS DI DUNIA NYATA! | #NERROR","Nessie Judge","2021-07-02T12:00:11Z"
"UCEHprhvK2xu0CYKcnbMshBw","ROMA ULANG TAHUN || KONTRAKAN REMPONG EPISODE 353","WARINTIL OFFICIAL","2021-07-10T03:00:14Z"
"UCNkWlcfB453o1sAWr3sFY7w","MCP SYSILIA - PASTI BALE (Official Music Video) Lagu Ambon Terbaru","MCP SYSILIA RAP MOLLUCAN LABRAK","2021-07-08T12:00:15Z"
"UClvgyQvIplPQU8N73vPlFUA","Legendary Reactions","AshStudio7","2021-07-14T09:52:45Z"
"UCKy1dAqELo0zrOtPkf0eTMw","Steam Deck: First Hands-On With Valve’s Handheld Gaming PC","IGN","2021-07-15T16:58:43Z"
"UCPgLNge0xqQHWM5B5EFH9Cg","England fans mourn Euro 2020 final heartbreak after penalty shoot-out","The Telegraph","2021-07-11T23:13:16Z"
"UC9LQwHZoucFT94I2h6JOcjw","Inside Training: Squad returns for first full pre-season session in Austria","Liverpool FC","2021-07-13T15:30:13Z"
"UCUhpu5MJQ_bjPkXO00jyxsw","Clip: Just A Sweet Morning Kiss! | Unforgettable Love EP09 | 贺先生的恋恋不忘 | iQiyi","iQIYI 爱奇艺","2021-07-13T14:00:18Z"
"UCKNZsAeQXpvI-Mpoc0ZKhsA","[4K] 왕소중하니까 왕크게 보는 💗왕크왕캠💗 NCT DREAM 나나💚 재민🐰 (Feat. 요정 런쥔🦊)","MBC Radio봉춘라디오","2021-07-12T09:00:01Z"
"UCEbRSmzD8xASRlYq2OLmCrg","지금 듣기 딱 좋은💞 온유(ONEW)x이수현(Lee Suhyun)의 〈깊은 밤을 날아서〉♬ 바라던 바다 (sea of hope) 2회 | JTBC 210706 방송","JTBC Music","2021-07-06T13:14:29Z"
"UCkrboHEREUVOaFNbuQ2taZg","말랑이 거래! 에어팟과 교환? #shorts popit DIY FIDGET TRADING Tiktok Compilation","프리티에스더 PrettyEsther","2021-07-12T08:32:03Z"
"UC8rHUssNDJ9YEjfduAqJBmw","BANGKRUT! MUKBANG NASI GORENG JUTAWAN TOPING STEAK SEGUNUNG","tanboy kun","2021-07-13T06:04:59Z"
"UCniqtXw3nZho_0HEO5IBqvg","Madison Beer - Reckless (Official Alternate Ending Video)","MadisonBeerMusicVEVO","2021-07-12T19:00:05Z"
"UCU_fuBEbZ0Wcf3ZNWEtxwzg","Nindi Dituding Jadi Perusak Rumah Tangga Olla Ramlan, Ini Faktanya Part 01- #HPS 08/07","Hotman Paris Show","2021-07-08T15:30:45Z"
"UC-inGkOwn_su3qh40RYC11A","Arief Muhammad Cari Kuli Bangunan Yang Dipecat Karena Tak Pakai Masker","TRIBUN LAMPUNG NEWS VIDEO","2021-07-12T04:21:07Z"
"UCVcdUPUEMqqRibLpx8HL3kw","DIHIPNOTIS ‼ AUREL : AKU MANUSIA BIASA , BISA MAAFIN TAPI GAK BISA LANJUTIN ‼","Uya Kuya TV","2021-07-16T12:00:13Z"
"UCvp0CPEB3M-iCkmT5RHYh7Q","BTS 'PERMISSION TO DANCE' MV REACTION","Alphiandi","2021-07-09T09:43:20Z"
"UCYk4LJI0Pr6RBDWowMm-KUw","PASTI MASUK PENJARA‼️Maafin laah.. - Deddy Corbuzier Podcast","Deddy Corbuzier","2021-07-15T04:20:00Z"
"UCGkKfpUonjN2N0qMNnyWizw","Ultraman Z RTV : Kekuatan Medal Belial (Episode 7)","Ultraman Indonesia RTV","2021-07-12T10:00:24Z"
"UCcSVA15A6UNouOvHsixy1ng","Kere Munggah Bale - Shepin Misa - New Pallapa ( Official Music Video )","PERDANA RECORD","2021-07-14T12:00:01Z"
"UCE9-bV_MCGgLnH7v4HSApDg","LORD ADI SALFOK SAMA APA YANG DIUCAPKAN OLIVIA - INCHEFTIGATION","Official RCTI","2021-07-11T12:00:22Z"
"UC5PBnSG7C0WXp5gjd4bzKtw","『ウルトラマントリガー』第1話(新)「光を繋ぐもの」-公式配信-","ウルトラマン公式 ULTRAMAN OFFICIAL by TSUBURAYA PROD.","2021-07-10T00:28:12Z"
"UCR-hohVc5y6wdrFc99Lk1_Q","Gunakan Baju Tersangka, Nia Ramadhani Menangis Akui Kesalahan dan Sampaikan Maaf #LIP 11/07","Lintas iNews","2021-07-11T03:11:52Z"
"UClvgyQvIplPQU8N73vPlFUA","Funny Penalty Kicks","AshStudio7","2021-07-06T09:51:42Z"
"UC86dbj-lbDks_hZ5gRKL49Q","Euro 2020: Italian team returns home after tournament victory | AFP","AFP News Agency","2021-07-12T05:44:28Z"
"UCMfyiLGzptAStxYf7GEIQYQ","Famous Chhangani Club Kachori of Kolkata🤩🤩 #streetfood #kolkata #clubkachori #kachori #shorts","Foodie Incarnate","2021-07-06T05:04:59Z"
"UC0uHeGDHQiNalfCg8S5J8Eg","SASYA ARKHISNA - BALUNGAN KERE (Official Music Video)","Adhigana Music","2021-07-13T12:00:10Z"
"UCEf_Bc-KVd7onSeifS3py9g","TAEYEON 태연 'Weekend' MV","SMTOWN","2021-07-06T09:00:09Z"
"UCZrV-3Mvk8KPX1wyCqs7vGw","Lionel Messi ● All Record Goals & Assists in Copa America 2021","Messi Magic™","2021-07-12T16:54:38Z"
"UCilqV3GecszUjixKZWsuZ-w","Jamie Miller - Here's Your Perfect (Acoustic)","Jamie Miller","2021-07-09T04:00:10Z"
"UC_pwIXKXNm5KGhdEVzmY60A","[슬기로운 의사생활 시즌2 OST Part 4] TWICE (트와이스) - 누구보다 널 사랑해 (I love you more than anyone) MV","Stone Music Entertainment","2021-07-15T01:16:47Z"
"UCU4G863Yc_RbkvzNTMKGacQ","When You Believe - Novia ft. Lyodra || Ruang Guru","Novia Bachmid","2021-07-13T13:15:32Z"
"UCyPQHLKgIbeld-8RAHB0Gwg","Argentina | Road to Final Copa America 2021","MM9 PRO HDI","2021-07-07T13:36:34Z"
"UC86dbj-lbDks_hZ5gRKL49Q","Argentina team returns home after Copa America victory | AFP","AFP News Agency","2021-07-11T13:56:11Z"
